ID,Author,Genre,Date,Cleaned Text,Provenance,Personnes,Lieux,Text Irregularities
TM 19019,nan,petition,AD 553,φλ βκτορ ἰδεσίμῳ ιπαρίῳ κώμης ἀφροδίτης αιοπολου νοῦ αὐρηλία ήνη ἰωάννου ἐκ μητρὸς θητοῦτος ἀπὸ τῆς ὐτῆς κώμης ἀφροδ αίρ οἱ ἑξῆς ὑποτεταγμένοι τετολμηκὼς παρανόμως βρειν καὶ ὅρκον ἀποθέσθαι μοι τῇ εἰρημένῃ εἰρήνῃ ὅτι λαμβάνω ε εἰς γυναῖκαν νῦν δὲ ἐχλευάσθην παρʼ αὐτοῦ τοίνυν ἐπιδίδωμι τῇ ὑμῶν ἐντρεχείᾳ τούτους μου τοὺς λιβέλλους παρακαλῶ οὖν καὶ μαι αὐτήν κελεῦσαι αὐτὸν ἐν ἀσφ ποιῆσαι ἄχρι κρίσεως δικαστικ chirho αὐρηλία εἰρήνη ἰωάννου ἡ προκ τοὺς λιβέλλους ὡς πκ αὐρήλιος ἐνὼχ ἡρακλείου ἀξιω εὶς ἔγραψα ὑπὲρ αὐτῆς ράμματα μὴ εἰδ εἰσὶν μακάριος χαλκοτύπ καὶ τκουικουις μήτηρ αὐτο μεὰ τὴν ὑπατείαν φλ βασιλείου τοῦ ἐξοάτου ἔτους δεκάτου ῶ κδ δευτές ἰνδ λίβελλ εἰρήνης ἰωάνν,Aphrodito,"φλαυιου βικτορι, ειρηνης, ιωαννου, θητουτος, αυρηλια ειρηνη, ιωαννου, ειρηνη, αυρηλια ειρηνη, ιωαννου, αυρηλιος ενωχ, ηρακλειου, μακαριος, τκουικουις, ","κωμης αφροδιτης, του ανταιοπολιτου νομου, απο της αυτης κωμης αφροδιτης",['γυναικαν: γυναικα']
TM 19020,nan,petition,AD 553,φλαυΐῳ βίκτορι αἰδεσίμῳ ιπαρίῳ κώμης ἀφροδίτης τοῦ ἀντοπολίτο νομο π αὐρηλ βίκτορς ἰωάννο ἐκ μ τσενπατοθία γεωργος μισθωτης ἀπὸ ἐποικο ψινίο πεδιάδ κώμης ἀφροδ τοῦ αὐτῦ νο χαίρ ποτετανος ς δικαστι αὶ εἰς μετέρ άλειαν εποίημαί σοι υς μου τοὺς λιβέλλους ὡς πρόκ αὐρ βίκτωρ ἰωάννο ὁ προκ ἐπιδέδκα τοὺς λιβέλλους ὡς πρόκ αὐρ βίκτορ ἑρμείο ἀξιωθὶς ἔγρα ὑπὲρ αὐτο γράμματα μὴ εἰδότος εσὶν δέ βίκτωρ βησίο γεωργο μισθιο μετὰ τὴν ὑπατείαν φλ βασιλείο τοῦ ἐνδοξοτάτου ἔτο ισκαιδεκάτο μεσορὴ ιη δέ λιβέλλους γεν π,Aphrodito,"φλαυιου βασιλειου, ιωαννου, τσενπατερμουθιας, ιωαννου, ερμειου, βησιου, φλαυιω βικτορι, αυρηλιου βικτορος, αυρηλιος βικτωρ, αυρηλιος βικτορ, βικτωρ, βικτορος, ιωαννου, ","κωμης αφροδιτης, του ανταιοπολιτου νομου, απο εποικιου ψινικου, κωμηκς αφροδιτης","['γεωργος: γεωργου', 'μισθωτης: μισθωτου', 'αξιωθις: αξιωθεις', 'γεωργο: γεωργος', 'μισθιο: μισθιος']"
TM 19021,nan,contract,AD 552 - 25,βασιλείας τοῦ θειοτάτου ἡμῶν δεσπό καὶ ὐτοκράτορος ἔτους εἰκόστου ἕκτο ἔτους δωδεκάτου φαρμ φλαυίῳ ἰουλιανῷ τῷ μεγαλοπρεπτάτῳ παγάρχῃ τῆς ἀαιοπολιτῶν δι φλ διοσκόρο ἀπολλῶτος καὶ ἀλλῶτος ἰωάννου εὐδοκιμωτάτων προτωκωμητ κώμης ἀφροδίτης τοῦ αὐτοῦ ἀνταιοπολίτου νομοῦ π τῶν ἑξῆς ὑπογραφόντω ὁμολογούντων τὰ ὑποτεταγμένα κάστου ἐνεχομένου τῇ ἰδίᾳ αὐτοῦ ὑπογραφῇ χρ μλῦμεν ἑκουσίως καὶ αὐέτως ἐπομνύμενοι τόν τε πανκράτορα καὶ τὴν νίκην καὶ σωτηρίαν καλλινίκου ἡμῶν δεσπότου φλ ἰουστινιανο τοῦ αἰωνίο αὐγούστου καὶ αὐτοκράτος ἐγγυᾶσθαι καὶ ἀναδεδέχθαι τῇ ὑμῶν μεγαλοπρεπείᾳ μόνης καὶ ἐμφανς ἐ νο εὐλέστατον ἀναγνώστην ἐπὶ τῷ αὐτὸν ἐμμεῖναι καὶ εὑρηθαι ἐν τῇ αὐτῇ κώμῃ ἀφροδίτης ἄνευ οἵας δήε κφρήσεως καὶ αἰσς πράξεως καὶ ὁπόταν ζητηθείη παρʼ ὑμῶν καὶ μὴ εηθη ἑτοίμως ἔχομεν ἡμ οἱ τούτου ἐγγυηταὶ διδόναι καὶ κταβαλεῖν ἐπὶ τὴ ν μεγαλοπρέπειαν πὲρ τῆς αὐτοῦ ἀπολείψεως χρυσο νομίσματα ἕξ γί χρ νο ϛ καὶ μηδαμῶς τὸν ἀπολείπεσθαι ἔνοχ εἴημεν τῷ θείῳ ὅρκῳ καὶ περὶ τούτω τουτου ἐπηρτημμένῳ υπερτημμενω κδύνῳ καὶ ἐφʼ ἅπαντα ἐπερωτηθέντες ὡμολογήσαμεν πέτρος ἀπολλ ποδιάκ το ἁγίο τόπο ἄπα ὡροωγχίο μάρτυρος ἐγγυομαι ν προκ ἐνὼχ εἰς χρυσο νομισμάτ ο καὶ αὐρήλιοι φβ ἀραοῦτος κουνακοπς ι ἐγγ τν οῦ νοσα δύο καὶ ἰωαννο κυριακο εἰς χρυσο νομισμάτιον καὶ ἰωαννο εναη εἰς χρυσο νοτιον ν ὁμο νο ἕξ γί νο ϛ καὶ ὀμόσαμεν τὸν θεῖον τὸν θεῖον ὅρκον ὡς πρόκ αὐρήλιος ἀποὼς ἰσακίο ἀξιωθεὶς ἔγραψα ὑπὲρ αὐτῶν γράμματα βίκωρ προμτος πρεσβ μαρτυρῶ τῇ ἐνγηομαι ς παρ τῶν θεμένων μωυσῆς φοιβάμωνο διάκ μαρτυρῶ ἐνγυομαι ἀκούσας παρὰ τῶν θμένων διʼ ἐμοῦ ιλάτ ἐγράφ,Aphrodito,"φλαυιω ιουλιανω, φλαυιου διοσκορου, απολλωτος, απολλωτος, ιωαννου, ενωχ, ιωαννου, πετρος, απολλωτος, απα ωρουωγχιου, ενωχ, αυρηλιοι φιβ, αραουτος, ενωχ, ιωαννου, κυριακου, ιωαννου, ψενθαησιου, αυρηλιος απολλως, ισακιου, βικτωρ, προμαυωτος, μωυσης, φοιβαμωνος, πιλατου, ","της ανταιοπολιτων, κωμης αφροδιτης, του αυτου ανταιοπολιτου νομου, εν τη αυτη κωμη αφροδιτης","['τον θειον: τον θειον', 'ευρηθηναι: ευρεθηναι', 'ευρηθειη: ευρεθειη', 'επηρτημμενω: επηρτημενω', 'τουτω: τουτου', 'εγγυο͂μαι: εγγυωμαι', 'ιωαννο: ιωαννης', 'ιωαννο: ιωαννης', 'ομοσαμεν: ωμοσαμεν', 'παρ: παρα']"
TM 19023,nan,contract,AD 548,ετὰ πατείαν φλ βασιλίου το νδάτου ἔτους ἕκτου φαρμοῦθι ϛ ἑνδεκάτης ἰνδ τῷ θαυμωτάτῳ διοσκόρῳ ἀπολλῶτος ἀπὸ κώ οδίτης τοῦ ἀνταιοπολίτου νομοῦ αὐρηλίο αίο σενουίο ἐκ μητρ ταπίας γοῦ μισθί πὸ κώμη ράβωνος τοῦ πανο νομο ὰ νῦν διαων ἐπὶ τ κώμης ἀφδίτης χαίρ ὁμολογῶ ἑτοίμως ἔχει κουφίσασθί ι ἀπὸ τοῦ ἐμοῦ μισθοῦ τοῦ ὑπὲρ τῆς δωδεκης ὀφείλοντος λημφθῆναι παρὰ σοῦ ο ἀρτάβας δέκα μέτρῳ σῷ ὑπὲρ ἀναχῆς ἀπολλῶτος τοῦ ὑδραγωγ τοῦ καὶ ἐμ γυναικαδέλφου καὶ μὴ δύνασθαί με ἐνάξαι σοι πὶ τούτον ἐν τῷ καιρῷ τῆς ἀλως τῆς σὺν ἐσομένης δωδεκάτης ἰνδ καὶ εἰς σὴν φάλειαν πεποίημαι τοῦτο τὸ ἀσφαλὲς μεθʼ ὑπογρφ τοῦ ὑπὲρ ἐμοῦ ὑπογράφοντος καὶ ἐφʼ ἐπερ ὡμολόγ ψάις σουθείου γεωρὼς ἀπὸ ἀράβονος ὁ προκ συμφον οι πρόκ αὐρήλιος κόλλουθος ψιμανωβετ ἀξιοθεὶ ἔγραψα ὑπὲρ αὐτοῦ γραμα μοὶ ἰδοτης αὐρή chirho κυρις νειου μαρτυρῶ ὀφιλῇ ἀκούσ παρὰ τ νου πιλάτου ν δέλφ τὸ παν ἀσφαλ κοφ,Aphrodito,"φλαυιου βασιλιου, διοσκορω, απολλωτος, αυρηλιου ψαιου, σενουθιου, ταπιας, απολλωτος, ψαις, σενουθειου, αυρηλιος κολλουθος, ψιμανωβετ, αυρηλιος κυριακος, , πιλατου, ","απο κωμης αφροκδιτης, του ανταιοπολιτου νομου, απκο κωμης αρκαβωνκοκςκ, του πανοπολιτου νκοκμου, επι της αυτης κωμης αφροδκιτης, απο ακραβονοκςκ","['αλωησεως: αλοησεως', 'τουτον: τουτων', 'γεωργως: γεωργος', 'συμφονει: συμφωνει', 'αξιοθεις: αξιωθεις', 'ιδοτης: ειδοτος', 'μοι: μη', 'οφιλη: οφειλη']"
TM 19024,nan,contract,AD 573,χγ τοῦ θειοτάτ ἡμῶν δεπότου φλυίο αὐγούστου αὐτοκάτορος ἔτους ὀγδόου κὰς τρίτη τῆς παρούς ἑβδόμης ἰνδικ τῷ δι τῆς ἁγία κονίας τοῦ νεοκτίσου νευκτισου ὄρους τῶν ἁγίων καὶ ριστοφων ἀποων ὠνομαμένου δὲ ἄπα ἀπολλῶτος ματ τοῦ καισαντος διὰ ἐνὼχ ἰωάννου εὐλαβεστάτου ζοντος καὶ οἰκομου τῆς αὐτῆς διὰ σ λαυΐου διοσκόρου οῦ τοῦ ρωτοτ κ φροντιστῦ κουρρος τῆς αὐτῆς ἁγίας κονίας κατὰ κέλσιν τοῦ αὐτοῦ σου πατρός διακειμένης ἐν τ ὄρει κώμ ἀφροδίτη τοῦ ἀνταιοπολίτου νομοῦ παρʼ ἐμοῦ ψα τοῦ καὶ ψου υἱοῦ ἀπολλῶτο ἐκ μητρὸς σιβύλας ἐλεεινοῦ μονάζοντος κὶ πρεσβυτέου ὁρμωμένου μὲν ἀπὸ κώμ τεμσηὺ σκόρψωμ οῦ ἑρμουπολίτου νομοῦ καταμένοντος δ νῦν ἐν τῷ ὑμετέρ ῆς αὐτῆς διακονία ὄρει τῶν ἐρημιτῶν μοναχῶν χαίρειν ρώην κατʼ ἔγγρφ ὑποθηκιμαίαν ἀσφάλειαν δύο ἀστάθμ ομισμάτων ἐνγύη ὑπθετό μοι ερὼ καρίτης φοιβμμ ελφός σου τοῦ προγεραμμένου ἐνώ οἰκομῶν τοτε κ αὐτὸ ἁγίαν διακονίαν έλλιον ἤτοι σεμνῖ χικὸν ἁπλοῦν ὑμ ελλίου αλένο σαίου σαι ιαφ τῇ ὑφʼ ὑμᾶς γιοτάτ διακονίᾳ ὡς καὶ τοῦτο διαφέρον αὐτῇ ἠνεωγμενο ἐπʼ ἀπηλειώτην ἐλθὸν ελθων εἰ τὴν ατὴν διακονίαν κατὰ δκ δωρεν παρὰ τοῦ μακαρίτου μουσαίυ ἀπογενομένου άζοντος ὁρου πρότερον ἀπ ώμης καλουμένης οβεσαντε τοῦ ὀξυρχίτου νομοῦ τὰ νῦν δ αὐτο τὴν οἴκησιν χοντ τοῦ κλυ ἀπὸ τότ μέχρι νν ᾔησα ὑμᾶς παρα καλέσα παραχωρσαί μοι τὸ ἔμπροθεν μκρὸν κέλλιον ἤτοι καβανω ἵνα εἰς γυσμον ποιήσω εἰς χρείαν τοῦ δομοῦσθαί τινα πενν τῶν ἐρημιτῶν ξένων μοναχῶν τῶν ὰ καιὸν τυχόν αὶ ἐρχομένων ερχομενον βουλν διὰ τὴν ένωσιν τῆς οἰκως οἰκῆσαι ἐν αὐτῷ ς καρποφορίαν αὶ αὔσιν ὑ άσης τς συνελεύσεως καὶ ἀμφεβάλλετε πρὸς ἐμὲ ὡς ἐσισται καὶ ἀποκέκλεισται τὸ ὄρος ἐκ παρα δόσεως τοῦ πρωτκτίστου καὶ ἐκ τούτυ ἐδυνήθην δυσωπῆσαι ὑμᾶς πρὸς τὸ φανέν μοι δίκαιον ἐπὶ ταύτῃ τῇ αἱρέσει τῇ ἑξῆς ηλουμένῃ διʼ ἣν ὁμολογῶ ὠμνὺς ομνυς τὸν φρικωδέστατον ὅρον ὥστε τοῦτο τὸ κέλλιον τὸ μέλλον κτισθῆναι παρʼ ἐμοῦ ἔτι μὴν τὸ ὑποθηκιμαῖον ὑπάρχον υπαρχων μοι τῶν δύο νομισμάτων ετὰ τὴν ἐμὴν τελευτ ταῦτα ὁμοῦ ἀμφότερα μετὰ ῆς ἔμπροσθεν καβάν ἀναδραμεῖν κυρίως τὴν αὐ ἁγίαν διακονίαν καθάπ κελεύω καὶ βούλομι κατὰ π δικαίαν δωρεὰν ἐπέχουσ τὸν inter vivos όπον ὥστε ταῦτ αι ἀκωλύτως καὶ ἀνεμποδίστως ὑπʼ οὐδενὸς τὸ σύνολον τῷ πρρημένῳ ἁγίῳ τόπ δεσποτικῷ δικαίῳ καὶ μὴ δύνασθαί τινα ν διαφερόνων μοι ἀνποιεῖσθαι τοτων κ οἷο δήποτε όπον κειμέ προστίμου ἐπὶ τούτῳ χρυσοῦ ισάτ δώδα κ πάλιν οὕτ ὑπ μόνης αραβάσεως καὶ ἐ ούις πᾶσι ολόγησα κ ὑπέργαψ,Aphrodito,"απα απολλωτος, ενωχ, ιωαννου, φλαυιου διοσκορου, ψα ψατου, σιβυλας, απολλωτος, φοιβαμμων, ενωχ, μουσαιου, μουσαιου, ","του νεοκτκιστουκ ορους των αγιων και χριστοφκορωκν αποστολωκν, ωνομασμενου δε απα απολλωτος, ονομκακτος του καινισαντος, κωμης αφροδιτης, του ανταιοπολιτου νομου, απο κωμης τεμσηυ σκορψωμκ, του ερμουπολιτου νοκμου, απο κωμης καλουμενης ακοκβεσανκτε, του οξυρκκυγχιτου νομου","['σεμνιον: σεμνειον', 'αγιοτατη: αγιωτατη', 'ηνεωγμενο: ανεωγμενον', 'απηλειωτην: απηλιωτην', 'δομουσθαι: δομεισθαι', 'αμφ’εβαλλετε: αμφιεβαλλετε', 'ωμνυς: ομνυς']"
TM 19025,nan,contract,AD 571 - 572,νων γῃδίων ἐκ λβὸς τῆς χερσαμπέλ καὶ παντοίοις παντοιας καὶ φοίνιξι φοινηξι καὶ ληνοπίθῳ καὶ ὁλοκλήρῳ λάκκῳ καὶ μονῇ καὶ πύργῳ ῇ ἐκεῖσε ἁγίᾳ ἐκκλησί κυμένῃ κυμενου ἄπα πόννιτος αὐτῷ κτήματι δικαίοις τε κ γείτονς δὲ τοῦ προκ ρʼ ἐμοῦ νῦν μετὰ παντὸς αὐτο το δικαίου καὶ τῆς καθόλου περιοχῆς εἰσὶν ὗοι υη ἐπὶ μὲν νότου ὅρια τῶν ἀρουρῶν ὡρουγχίου σενελαλε λιτου γῄδια το γεωργίου τῆς ἁγίας κκη ἄπα μουσαίου ἐπὶ δὲ βορρᾶ γῄδια ταντβεο τοῦ βττου βττος προμαῶτος ἐπὶ δὲ λιβὸς δημοσία ὁδὸς τοῦ ὄρους ἢ οἷοι ἂν ὦσι ωσει γείτονες πάντῃ πάντοθεν τιμῆς δὲ τῆς πρὸς ἀλλήλους συμπεφωνημένης καὶ συνράσης τελείας καοῦ χρυσο νομίσματα δώδεκα ἕκαστον παρὰ κεράτια δύο τ χρυσοχοϊκῷ σταθμῷ τῆς αὐτῆς κώμης γί χρ νο ιβ π κ κδ ἅπερ ταῦτα τῆς τιμῆς χρύσινα φα ἐγὼ ὁ ἀποδόμενος ἑρμαύως πα ο πριαμένου ἰσακίου γεωργίου διὰ χειρός σ εἰς χεῖράς μ π ὑπογραφόντων μαρτύρων ἀριθμῷ καὶ σταθμῷ ἅα τῇ παρούσῃ πράσει γενομένῃ γενομενης σοι παρʼ ἐμο ἐφʼ ᾗτινι εὐδοκῶ καὶ πίθωμαι πρὸς τὼ σὲ ἀπεντεῦθεν κρατεῖν καὶ κυριεύειν καὶ δεσπόζειν το προδηλωθέντος ὁλοκλήρου πατρῴου κτήμ ντὸς αὐτο το δικαίου καὶ χρηστηρίων ἁπάντων ἀπὸ τοῦ νῦν ὡς προεῖπον ἐπὶ τὸν ἀεὶ καὶ παντελῆ χρόνον καὶ ἐξεῖνα σοι ἐπʼ αὐτῷ πάντα πράττειν κατὰ πᾶσαν ῆ ἐξουσίαν δε καὶ αὐθεντίαν καὶ νέμεσθ καὶ κτήσασθαι καὶ παραπέμπειν ἐπὶ κληρονόμους σοὺς παντοίους καὶ διακατόχους ἢ καὶ μεταποιεῖν καὶ ἐκποιεῖν τοτο καὶ χρήσασθαι καὶ ἀντικαταλλάττεσθαι αντικαταλαττησθαι οἷς βούλει προσώποις προσσωποις ἁπαξαπλῶς παντὶ τρόπῳ κυριευτικῷ χρήσασθαι διὰ παντὸς εἰς τὸ παντελές ἀκωλύτως καὶ ἀνεμποδίστως καὶ ἀνεγκλήτω ανεγκλητο γκες ὑπʼ οὐδενὸς τὸ σύνολον τῶν ἐμοὶ διαφερόντων ἐκ πάσης συνγενείας μο καὶ ἑτοίμως ἔχω ἐγὼ καὶ κληρονόμοι μου παντοῖοι ἀεί ποτε καὶ διάδοχοι διαδοχη καὶ διακάτοχοι διακατοχη βεβαιώσασθαί σοι καὶ καθαροποιήσασθαι καὶ κληρονόμοις σοῖς δόχοις καὶ διακατόχοις τὴν το προκ ὁλοκλήρο κτής καὶ πραθέντος σοι παρʼ ἐμοῦ καθαρὰν νομήν τε καὶ δεσποτείαν μὴ προυποκειμένην οἵῳ δήποτε ὀφλήματι δημοσίῳ τε καὶ ἰδιωτικῷ ἀλλὰ πᾶσαν ἄδειάν σοι δίδωμι ἀπὸ τοῦ νῦν διὰ παντὸς εἰς τὸ παντές τοτο οἰκονομεῖν καὶ βελιοῦν ἢ καὶ φορολόγειν καὶ ἐκμισθώσασθαι καὶ καρποῦσθαι καὶ ἀνάξαι εἰς φυτείαν ἀμπέλου τε καὶ παντοίων φυτῶν καὶ συγκομίσασθαι τοῦτο καθ ἔτος καὶ εἰσφέρειν τῷ δημοσίῳ λόγῳ τὴν πᾶσαν αὐτο συντέλειαν ἔν τε τη σίτῳ ἐμβολῆς καὶ ναύλοις καὶ χρυσικοῖς παντοίοις δημοσίοις τίτλοις πρὸς τ γραφὴν τοῦ μοσίου κώδικος οῦ τῆς λογίας μήμης ἰωάννου ἀπογενομένου σχολαστικο καὶ κηνσίτορος καὶ κατὰ μίμησιν πάντω τῶ κτητόρων κτητωρων τῆς αὐτῆς κώμης ἀφροδίτης ἀποκρίνασθαί σε τὰ παντοῖα τούτο βάρη διηνεκῶς διενεγκως πρὸς τὴν ἀνηνεχθεῖσαν ανενεχθεισαν κατὰ τοῦ αὐτοῦ κτήματος τοῦ αὐτοῦ σοφωτάτου ἀνδρός μέτρησιν ἀρξάμενόν σε τὴν τούτου δημοσίου εἰσφορὰν ποιήσασθαι ἀπὸ καρπῶν καὶ κανόνος τῆς σὺν μελλούσης ἕκτης ἰνδ καὶ αὐτῆς καὶ τοῦ ἑξῆς χρόνου διὰ παντὸς εἰς τὸ παντ ῶν σῶν ε οτε κ διαδόχων καὶ διτόχ μηδενὸς ὑμῖν ἐναιουμένο ἢ ἀναντινοησομένο πώποτε μήτε δυνησομένο κίνειν καθʼ ὑμῶν περὶ τούτου ἐν οἵ δήποτε καιρῷ ἢ χρόνῳ ἐν δικαστηρίῳ οἵῳ δήποτε ἢ ἐκτὸς δικαστηρίου μικροῦ ἢ μεγάλου περὶ πλείονος πλιωνος ἢ περὶ ἐλάσσονος τιμῆς περὶ περαιτέρω ταύτης τῆς προσημανθεῖσαν καὶ ἀρεσθείσης νῦν μεταξὺ ἡμῶν ἀμφοτέρων ἀλλὰ καὶ ἑτοίμως ἔχω ἐγώ δε καὶ παντοῖοί μου κληρονόμοι ἀποστρέψαι ῆαι πάντα ἄνθρωπον ανθρωπων ἐπελευσόμενον κατὰ σο τε καὶ κληρονόμων σῶν ντιθησόμ το προειρημένου κματος ἐκ μέρος αὐτοῦ ἢ ἐκ κεφαλαίου ἰδίοι μῶν ἀναλώμασι καὶ δαπανήμασι ταπανημασι κινδύνῳ καὶ πόρῳ τῆς παντοίας μου ὑποστάσ ενικῶς καὶ ἰδι ἐνεχύρου λόγῳ καὶ ὑποθήκης δικαίῳ ὑποκειμένης ὑμῖν εἰς τὴν βεβαίωσιν ἀεί ποτε καὶ καθαροποίησιν ταύτης τῆς παρʼ ἐμοῦ διαπράσεως κρας οὔη καὶ βεβαίας πανταχοῦ προφερομένης καθʼ σον σων ἤδη ἐβεβαίωσα καὶ βεβαιώσω ὑμῖν πάσῃ βεβαιώσει ἀπὸ παντὸς καὶ διὰ παντὸς τοῦ ἐπελευσομένου ἢ ἀντιπμένο οτο πάντοτε παντετε ἐξ οὗ μέρς οἷον δήποτε καθʼ οἷον δ πον μὴ κτὰ χερας ἐμοί τε καὶ κληρονόμοις μο ἀλλὰ καὶ ἐκ τοῦ συνόλου πεπράμενόν σοι δέδοται τὸ ροειρη κτῆμα ὡς ἂν ὠφείλεται καὶ εἰ ἧττον φροντίζομεν τῆς αὐτοῦ βεβαιώσεώς τε καὶ καθαροποιήσεως καθαροποιησασθαι ἐγώ τε καὶ κληρονόμοι κληρονομου μου διὰ παντὸς εἰς τὸ παντελές τριπλασίως τὸ προκ ττο τίμημα ἀποδώσομεν κ τὰ ντοῖα ὡσαύτως διπλᾶ ἀναλώματα καὶ δαπανήματα τὰ εἰς βελτίωσιν τούτου καὶ καλλιέργειαν ἀναλωθησόμενα παρὰ σο μετὰ καὶ τοῦ μετὰ ταῦτα εἶναι τὴν παροσαν γγραφον πρᾶσιν κί καὶ βεβαίαν καὶ στιπη καὶ ἀσάλευτον καθότι καὶ ἔστιν καὶ ἐφʼ ἅπα τοῖς ἐν αὐτῇ προγεαμμένοις ὁμολογήμασι ἐπερευτηθεὶς παρὼν παρὰ παρντων μαρτρων ὡμολόγησα ταῦθʼ οὕτως ἔχειν δώσειν ποιεῖν φυλάττειν εἰς πέρας ἄειν ὡμολόγησα εὔδηλον δὲ ὅτι τῶν δημοσίων τοῦ αὐτοῦ κτήματος παντὸς τοῦ παρωχηκότος χρόνου μέι τῆς πούσης πέμπτης ἰνδ καὶ αὐτῆς ἔν τε σίτῳ καὶ,Aphrodito,"απολλωτος, μηνα, αβρααμιου, νεου, απα ποννιτος, ωρουωγχιου, σενελαλε, απα μουσαιου, ταντβεου, βοττου, προμαωτος, ερμαυως, ισακιου, γεωργιου, ιωαννου, πετρου, διοσκορου, διοσκορου, διοσκορος, ",της αυτης κωμης αφροδιτης,"['*,: *,', 'ενταγι: ενταγι', 'ωμολογησα.: ωμολογησα.', 'πιθωμαι: πειθομαι', 'τω: το', 'δε: τε', 'καθ’: κατʼ', 'ανηνεχθεισαν: ανενεχθεισαν', 'προσημανθεισαν: προσημανθεισης', 'δε: τε', 'ωφειλεται: οφειληται']"
