ID,Author,Genre,Date,Cleaned Text,Provenance,Personnes,Lieux,Text Irregularities
TM 21049,nan,contract,AD 549 - 550,gaplines αὶ πύργῳ καὶ κ λιαστηρίῳ ὁλοκλήρῳ καὶ χαρακῶνι καὶ φυτοῖς καὶ φοίνιξι κ πωμαρίῳ καὶ ἐλαῶσι καὶ ἀχυροθήκῃ τῇ ἐντὸς τῆς λιβικῆς αὐεντικς θύρας σὺν φυτοῖς ὅλοις ἐνκάρποις τε καὶ ἀκάρποις αῳ νεοφυτίῳ καὶ τοῖς δυσὶ ξυλίνοις ὀργάνοις διακείμενον ἐν τῇ αὐτῇ νοτίνῃ πεδιάδι τῆς αὐτῆς κώμης ἀφροδ ἐν κλήρῳ φερκω ἐκ νότο το κτήματος το εὐαγοῦς μοναστηρίο γενεαλίο ἐφʼ ᾧ με τοῦτο ἔχειν ὑπʼ ἐμὲ καὶ τὴν πᾶσαν γεωργικὴν αὐτο ποιήσασθαι ἐργασίαν ἐκ τῶν ἰδίων μου ζώων καὶ ἀναλωμάτων καὶ ωργῶν πρὸς ἑξαετῆ χρόνον λογιζόμενον ἀπὸ καρπῶν τῆς σὺν θεῷ ἐσομένης τρισκαιδεκάτης ἰν καὶ αὐτῆς καὶ τοῦ ἑξῆς χρόνο καὶ διδόναι ὑμῖν τὸν φόρον ἐπʼ ἀποτάκτῳ ἐν τελείῳ καὶ ἀβροχικῷ ὃ μὴ εἴη φορᾶς τε καὶ ἀφορίας πασῶν των περιέξωθεν ἀρουρῶν λιβικῶν τε καὶ ἀπηλιωτικῶν το αὐτο κτήματος πρὸς ἀναμέτρησιν τοῦ δημοσίο σχοινίο ἀπὸ ἑξήκοντα τεσσάρων ἀμμάτων επισθουμενθος ἑκάστης ἀρούρης ἀνὰ σίτο καθαρο καὶ φορικοῦ ἀρτάβας τέσσαρας καὶ κριθῶν ἀρτάβην μίαν μέτρῳ τῆς οὐσίας τοῦ τῆς μεγαλοπρεποῦς μνήμης κόμετος ἀμμωνίο γεωργήσω δὲ ὑμῖν τὴν πλαστὴν γῆν ἤτοι χερσάμπελον ἐφʼ ἡμισείας καθʼ ἔτος καὶ τὴν ταύτης δώσωμεν ἐκ το κοινο σπερμαβολίαν καὶ ἀμπελικὸν νεοφυτῖον φιλοκαλέσω καὶ ποτίσω ἀκαταφρονήτως χειμῶνί τε καὶ θέρει σπείρω δὲ ὑμῖν ὡσαύτως ἐφʼ ἡμισείας ἐπʼ ἀναβάσει βονῇ τὸν ὑμέτερον βουνὸν τὸν ἐξ ἀπηλιώτ τῶν ἀπηλιωτικῶν γῃδίων το αὐτο κτήματος λεγόμενον ἄπα διοσκόρο καὶ το καιροῦ γενομένο καθʼ ἔτος τῆς συνκομιζῆς τὸ περιεσόμενον ἡμῖν γένημά τε καὶ ἄχυρον ἔκ τε το βουνο καὶ τῆς αὐτῆς πλαστῆς γῆς ἤτοι χερσαμπέλο μερισθήσεται εἰς ἡμᾶς κατὰ τὸ ἥμισυ μέρος εἰς ἐμὲ μὲν λαβεῖν μέρος ἓν ὑπὲρ τῶν ἐμῶν καμάτων εἰς ὑμᾶς δὲ τὸ ἄλλο μέρος ὑπὲρ τῶν ἐκφορίων παρέξω δὲ ὑμῖν καθʼ ἔτος ὑπὲρ ἀργυρικοῦ τοῦ γεουχικοῦ ὑμῶν ἡμίσους μέρους τῶν ἐκεῖσε φοινίκων χρυσο τριμήσιον ἓν συναλλαγῆς πρὸς παρὰ ἓν τοῦ νομίσμτ χρυσοχ σταθμ τῆς ολ κώμ ἐν τῷ μηνὶ τῦβι καθʼ ἔτος ὁ δὲ καρπὸς τῶν ἐλαίων καὶ τῆς μυξαίας καὶ το καρποῦ τοῦ πωμαρίο καὶ τῆς καλαμίας ἐφʼ ἡμισείας στελλομένου δὲ ὑμῖν τοῖς γεούχοις καθʼ ἔτος ἑνὸς φοινκος λεγομέν ἰωάννο τοῦ ἐπάνω τῆς ἀμάρας παρέξω δὲ ὑμῖν καθʼ ἔτος ὑπὲρ το μισθοῦ τῶν δύο ξυλίνων ὑμῶν ὀργάνων σίτο καλο ἀρτάβας δεκατρῖς σὺν τῇ συντάξει το τέκτονος μέτρῳ το ὄρους παρέξω δὲ ὑμῖν καθʼ ἔτος ὑπὲρ δαπάνης τοῦ φόρου οἴνο ἀγγῖα δύο καὶ κρέως λίτρας δώδεκα καὶ λεμψάνης κολοβὰ τεσσαρας καὶ τυροὺς ξηροὺς καλοὺς γεουχικοὺς ἑκατόν καὶ τὴν μεταφορὰν ποιήσω τοῦ τε φόρο καὶ το ἡμίσους μέρους ὑμῶν τῆς πλαστῆς γῆς καὶ τοῦ βουνοῦ γενήματος τε καὶ ἀχύρο εἰς τὸ ὄρος ἀναμφιλόγως ἡ μίσθωσις κυρία ἐσται καὶ βεβαία καὶ ἐφʼ ἅπαντα ἐπερθ ὡμολόγησα αὐρήλιος ἰακὸβ δαυεὶδ ὁ προκ μεμίσθωμαι ὡς πρόκ διόσκορος ἰωσηφίου πρεσβ ἀξιωθὶς ἔγραψα ὑπὲρ αὐτοῦ γράματα μὴ εἰτότος ιτοτης ψᾶϊς ἀπολλῶτος πρεσβ μαρτυρῶ τῇ μισθώσει ἀκούσας παρὰ τοῦ θε μεο  διʼ ἐμοῦ ἑρμαυῶτος νομικο ἐγράφ monogram,Aphrodito,"αμμωνιου, διοσκορου, ιωαννου, διοσκορος, ιωσηφιου, αυρηλιος ιακοβ, δαυειδ, ψαις, απολλωτος, ερμαυωτος, ","της αυτης κωμης αφροδιτης, εν κληρω φερκω, του ευαγους μοναστηριου γενεαλιου, της ουσιας τοκυκ κομετος αμμωνιου","['οκλ: οκλ', 'καρπου του: καρπου του', 'τρισκαιδεκατης: τρεισκαιδεκατης', 'των: ων', 'καθʼ: κατʼ', 'νεοφυτιον: νεοφυτειον', 'σπερμαβολιαν: σπερμοβολιαν', 'φιλοκαλεσω: φιλοκαλησω', 'καθʼ: κατʼ', 'συνκομιζης: συνκομιδης', 'καθʼ: κατʼ', 'καθʼ: κατʼ', 'μυξαιας: μυξεας', 'καθʼ: κατʼ', 'φοινκος: φοινικος', 'καθʼ: κατʼ', 'δεκατρις: δεκατρεις', 'καθʼ: κατʼ', 'αγγια: αγγεια', 'λεμψανης: λαμψανης', 'τεσσαρας: τεσσαρα', 'εσται: εστω', 'αξιωθις: αξιωθεις', 'γραματα: γραμματα', 'ειτοτος: ειδοτος', 'ελαωσι: ελαιωσι']"
TM 23587,nan,contract,AD 569,μγ θ βασιλείας καὶ ὑπατείας τοῦ θειοτάτου ἡμῶν δεσπότου φλα ἰουστίνου τοῦ αἰωνίου αὐγο αὐτοκράτορος ἔτους τετάρτου θὸθ ὀγδόῃ τρίτης ἰνδ ἐν ἀντι πόλει τῇ λαμπρο ταύτην τίθενται καὶ ποιοῦνται πρὸς ἀλλήλους τὴν ἀντισύγγραφον κοινὴν ὁμολογίαν τῆς δισσῆς ὁμοτύπου γραφείσης ἀποζυγῆς καὶ διαίσεως τοῦδε τοῦ ῥεπουδίου ἐκ μὲν τοῦ ἑνὸς μέρους αὐρηλία ἀμαρεσία θυγάτηρ προουτος τοῦ πραγματευτοῦ ἐκ μητρὸς φανείας ὁρμωμένη ἀπὸ ταύτης τῆς καλλιπόλ ἀντινοέων ἐκ δὲ θατέρου μέρους αὐρήλιος θεόδωρος υἱὸς γεωργίου ἐκ μητρὸς νόννας μίσθιος μάγκιψ ὁρμώμενος ἀπὸ τῆς αὐτῆς ἀντι πόλ ἀλλήλοις τὰ ἐφεξῆς ἐπὶ λέξεως οὕτως πρώην συνήφθημεν ἀλλήλοις πρὸς γάμου καὶ βίου κοινωνίαν ἐπὶ χρησταῖς ἐλπίσι καὶ τέκνων γνησίων ἀγαθῇ σπορᾷ οἰόμενοι μὲν τὸ ἀλλήλων ἐκτελέσαι εἰρηνικὸν σεμνὸν συνοικέσιον ἐφʼ ὅλον τὸν τῆς ἐξ ἀμφοῖν ζωῆς χρόνον ἐκ τὲ τῶν ἐναντίων οὐκ ἴσμεν πόθεν παρὰ προσδοκίαν ἐκ σκαιοῦ πονηροῦ δαίμονος ππόνθαμεν ἐπεμβρίσαντος ἡμᾶς τοῦ ἀπʼ ἀλλήλων χωρισθῆναι κατὰ τοῦτο εἰς τὸ παρὸν ῥεπούδιον ἐληλύθαμεν τοίνυν ὁμολογοῦντες μηδένα λόγον ἔχειν μήτε ἕξειν πρὸς ἀλλήλους ἀπεντεῦθεν ἤδη τοῦ λοιποῦ περὶ οἱουδήποτε πράγματος ἐγγράφο ἢ ἀγράφου ἀκρίτου ἢ κεκριμμένου μήτε περὶ γάμου συναφείας καὶ τούτου ἕδνων καὶ προικῴων καὶ ἀναλωάτων γάμου μήτε μὴν περὶ σκευῶν συνεισηνεγμένων ἀλλήλοις παρʼ ἀλλήλω μήτε περὶ ἄλλου τινὸς πώποτε πράγματος τὸ σύνολον ἀλλὰ καὶ παραχωρῶ ἐγὼ ἀπεντεῦθεν προγεγραμμένος θεόδωρος τοῖς κοινος γενομένοις μετʼ ἀλλήλων μέχρι τῆς δεῦρο νοις ἅμα ῷ ἐν γαστρὶ βρέφει τὴν οἰκητικήν μου οἰκίαν μετὰ παντὸς αὐτῆς τοῦ δικαίου τῶν ἐν αὐτ ηκόντων μοι αγμάτων παρὲξ τῆς στρώμνης μου καὶ τῶν ἐμῶν θημάτων καὶ ὁμολογοῦμεν ἐξαι ἑκατέρῳ μέρει ἡμῶν ἡμίκα ἐὰν βουληθείη ἑτέρῳ γάμῳ ὁμιλῆσαι ἀκολύτως καὶ ἀνεγκλήτως ἐπάναγκες μὴ δυναμένου τινὸς ἡμῶν καθʼ οἱον δήποτε τρόπν ἢ χρόνον ἢ τόπον ἐξ ασδήποτε αἰτίας ἐνάξαι τῷ ἑτέρῳ ἐν δικαστηρίῳ οἱω δήποτε ἢ ἐκς δικαστηρίου περί τινος πράγματος τὸ σύνολον διὰ τὸ ἡμᾶς ἐντεῦθεν ἤδη ἀπηλλάχθαι πρὸς ἀλλήλους καὶ διαλελύσθαι ἐντόνως καὶ τελείως αὶ εἰ τολμήσει τις ἐξ ἡμῶν ἐνάξαι τῷ ἑτέρῳ παρέξει λόγῳ προστίμου χρυσοῦ νομίσμτ ἓξ εὔσταθμα μετὰ καὶ τοῦ αὐτὸν ἄκοντα ἐμμεῖναι πᾶσι τοῖς προγεγραμμένοις ἐφʼ οἷς ἐρωτηθέντες ὡμολογήσαμεν,Antinoopolis,"αυρηλια αμαρεσια, προουτος, φανειας, αυρηλιος θεοδωρος, γεωργιου, νοννας, θεοδωρος, ","εν αντινοου πολει, ορμωμενη απο ταυτης της καλλιπολεως αντινοεων, ορμωμενος απο της αυτης αντινοου πολεως","['με: με', 'τε: δε', 'διαισεως: διεσεως']"
TM 23677,nan,letter,AD 514 - 536,stauros ἐδεξάμην τὰ γράμματα τῆς σῆς εὐδοκιμήσεως καὶ θέλω αὐτὴν πρὸ διαφαύματος καταλαβεῖν τὴν πόλιν φέρουσαν καὶ τὰ τοῦ κυρίου χριστοδώρου τοῦ σιγγουλλαρίου πρὸ πάντων καὶ περὶ οὗ εἶπόν σοι ἐνεγκεῖν εἰς λόγον τοῦ φίλου ἀλλὰ πάντως κατάλαβέ μοιε πρὸ διαφαύματος ἐπίδ τῷ ἀπολλῶτι πρωτοκ π ἰωάννο,Aphrodito,"χριστοδωρου, απολλωτι, ιωαννου, ",,"['φερουσα: φερουσα', 'σιγγουλλαριου: σιγγουλαριου']"
TM 23678,nan,receipt,AD 560 - 561,δέδωκεν ἀπολλῶς διοσκό λόγ δημό ἀστικ πόλ ἀνταίο γ καταβολ ἐννάτης ἰνδ κερ δύο ἥμισυ τρίτον ρχ δ ἐμοῦ μηνᾶ ὑποδέκ ἐξέδωκ ἐντάγι ὡς πρόκ,Antaiopolis,"απολλως, διοσκορου, μηνα, ",πολεως ανταιου,['εννατης: ενατης']
TM 23699,nan,letter,AD 566 - 567,πρὸ μὲν παντὸς λόγ κυνῶ τὴν ὑμετέραν ἀξιωθῶ αὐτὴν κατόπιν ων διὰ μακαρίου τοῦ ποιμς φθλᾶ βίκτορος τοῦ ἀδελφοῦ αὐτοῦ ὑποδειξάντων μοι οστρακʼ ατουσι ὡς λέγουσιν περι έχουσαν τὸ ὄν μου τὰ νῦν καταξιούτω μὴ ἀνέχεσθαι συναρπαγῆναι παρά τινος κάτʼ ἕνου ου γὰρ ἐμίσθωσα μη ἀρούρας ποτὲ τοῦ ἀπόρου οὐ γεγενημυ χρεωστῶ ἀλλὰ τὸν γεωργό ου ἐπίασεν κολλοῦθος ὁ ἀπὸ διαδοτῶν ὅτε ἐδιοίκησεν ἀπαιτ αὐτὸν μίσθωσιν ὀν λεγομ ἰωάννου εὐπρεπείου ἐμοῦ μὴ ὄντος ἐν τῇ κώμῃ καὶ ἐλθόν α τὸ ὄν τοῖς λαμπρ τρακτευτ καὶ τῷ βοηθῷ καὶ τῷ κοινῷ δεσπό τῷ κυρίῳ μηνᾷ καὶ ἔγνωσαν τὸ ὄν ἐν κείνῳ ὃν ν τῷ τόπῳ πκαρκάρου ἐστὶν ὑπὸ τὸν υἱὸν ταχυμίας κ παρεγγέλθησαν οἱ ποιμ ἀπὸ τότε χωρῆσαι κατʼ αὐτοῦ κ ἀπέστησαν τοῦ γεωργοῦ καταξιώσατε κ ὑμεῖς μαθεῖν τοῦτο αὐτοὶ καὶ μὴ ἐᾶσαι ὑμᾶς συναρπαγῆναι ὅπως κἀγὼ κελευόμενος ἀόκνως ὑμῖν ὑπουργῆσαι ἐλάχ δέ τινα ἀπέστειλα ὑμῖν τοῦτʼ ἐστὶν ᾦα πεντήκοντα μὴ ὀκνείτω δέξασαι εἰς μνπος τ,Aphrodito,"μακαριου, βικτορος, κολλουθος, ιωαννου, ευπρεπειου, μηνα, ταχυμιας, μνπος, ","φθλα, ενκ τω τοπω πκαρκκακκρκου","['ου: ου', 'κεινω: εκεινω', 'κατʼ: καθʼ']"
TM 23712,nan,receipt,AD 538 - 539,φλ κῦρος λαμπρ πολιδευμενο παυλοτι διωσκωρυ φροτίτη παρὰ σοῦ τὸν φόρον ον ὑπὸ ρὶ πετία κώμης φθαλ ν μεισθωσεως κανόνος δευτέρας οιπημαι ταύτην τὴν πληρωτικὴν ἐμοῦ βίκτορος πρεσβ κα,Aphrodito,"φλαουιος κυρος, βικτορος, απαυλοτι, διωσκωρου, κυρος, βικτορος, ","απο αφροτιτηκς, κληρου πια σε, κωμης φθαλ","['αφροτιτης: αφροδιτης', 'τον: των', 'πετια: πεδια', 'φθαλ: φθλα', 'πεποιπημαι: πεποιημαι']"
TM 23772,nan,letter,AD 573 - 574,αχθεις παρὰ τῶν ἁγίων ἐρημιτῶν ων τῆς διακονίας κ τοῦ πατρὸς ῶν καὶ ἐν μακαρίοις τὴν μνήμην ἀπολλῶτος ὀνότος ἀκηδιάσας ἐνὼχ ὁ εὐλαβ κονόμος αὐτῆς διὰ τὰ ἀφαιρηθέντα ζῷα καὶ κλαπέντα τῆς αὐτῆς διακονίας τησεν ἀναχωρῆσαι καὶ ἐᾶσαι τὸν ἅγιον τόπον ἀδιοίκητον εἰς βλάβην οτάτου δημοσίου λόγου καὶ τοῦτο μαθὼν ολεγον δυσωπῆσαι αὐτὸν καὶ ψυχαγωγῆσαι τοῦ μεῖναι χάριν καὶ πολλὰ πάνυ ποιήσας ἕως οὗ ἐδυνήθην πεῖσαι αὐτὸν πεμφθέντα μεθʼ ἑτέρων μοναζόντων ἐπὶ τὰ ἄνω μέρη δὰ τὰ αὐτὰ ζῷα εἴ που εὕρωσι ταῦτα ἀναλαβε τοῦ δʼ ἀνεῖναι ἐδηλώθησαν παρὰ τῶν ἀπο βολιμαίων ἀγροφυλάκων τῆς κώμ ἡμῶν καὶ δυσσεβῶν καὶ ὑπερθετικῶν χλευαζόντων αὐτὸν ἡμέριον τὴν τῶν παραγωγὴν ποιῆσαι οὐκ ἐποίησαν διὸ τοίνυν παρακαλῶ τὴν ἀεὶ προσυνουμένην ᾶσι λαμπρὰν ὑμῶν δεσποτείαν εἰς χάριν τοῦ θεοῦ πρὸ πάντων καὶ τοῦ μακαρίτου ἡμῶν πατρὸς καὶ τῆς ὑμῶν φυχῆς τὸ συμβαλλόμενον κελεῦσαι ἐναπο φροντίζειν ἐκ ψυχῆς τοῦ αὐτοῦ ἁγίου τόπου ἀδιαφόρως ὡς ἰδίου ὑμῶν ὄντ καὶ ἀποπαῦσαι λουκανὸν ἢ κ λοιποὺς τοὺς θέλοντας καινοτομῆσαι τὸ εὐαγ ρος καὶ παρὰ ἔθος ἕλκεσθαι ζητοῦντας τοῦτο εἰς ἀφαριανοὺς λόγους κτήτωρ ἐστὶν λουκανὸς κ οἱ λοιποὶ κ οὐδέποτε ἐξ ἔθους δεδώκασιν δεσποτικὴν πρόσοδον τούτου τοῦ τρόπου κτήτωρ ἐστὶν καὶ αὐτὸς ὁ εὐαγὴς θῦ οἶκος μὴ οὗν ἐπιλάθεσθε τῆς ἐνούσης ὑμῖν κατὰ θν εὐσεβείας καὶ τῆς μνήμης τῶν ἀλλήλους φιλούνν μακαριτῶν ἡμῶν πατέρων ἐξαιρέτως δὲ τῆς παραθέσεως τοῦ μεγαλοπρε κόμετο ροθέου παραγγείλαντος ὑμῖν φροντίζειν τοῦ αὐτοῦ ὄρους διὰ τὸ ψυχωφελὲς πρὸ πων καὶ διὰ τὴν πλείστην εὔνοιαν ἣν ἔχει ἐκ παιδὸς εις τὸν θεοφιλέστ ἄπα τατιανὸν ἀδελφὸν αὐτοῦ ὄντα κατὰ μητέρα αὐτοῦ τροφὸν μεγάλην αὐ εναμένην καὶ παρίδητε καὶ συγχωρήσητε τὸν εὐαγῆ θῦ οἶκον καινοτομηθῆναι ἐπ ὑμῶν διοικήσεως ὅπερ οὐκ ἐξεγένετο πρὸ ὑμῶν ὅπως ἂν τὰ πλεῖστα ἐν τούτῳ εὐχαριστήσω καὶ ἐπὶ πλεῖον ὁ θεσπέσιος ἄγγελος τοῦ τόπου καὶ τῶν ἁγίων ἐρημιτῶν μοναζ ἡκαίως ἀντεισάξῃ ὑμῖν κ τοῖς ὑμετέρ υἱοῖς ἀφόρητα ἀγαθὰ ἔπειτα δὲ ὅπως οἱ μοναχοὶ τὴν εὐεργεσίαν ὑμῶν ἐξείπωσι τῷ αὐτῷ ὄρει λκον ἀλλʼ εὐαγγελμενοι πανταχῇ τὸ κλέος ὑμῶν εἰς ἔπαινον ὑμῶν πάντοτεασαμεν ὅλοι τόδε ς ἐμοῦ πρὸς ὑμᾶς ὁ ἐ ἀσπασμὸς καὶ ἡ ἐμὴ προσκύνησις ντινῳ νειλ,Aphrodito,"απολλωτος, ενωχ, λουκανον, λουκανος, δωροθεου, τατιανον, ",αφαριανους,[]
TM 23845,nan,receipt,AD 552 - 553,δέδωκεν ἀπολλῶς διοσκώρου δ φοιβάμμωνος τριαδέλφου εἰς λ δημόσιον κωμτ κώμ φθλᾶ β κατλ κανόνος πρώτ ἰνδ κεράτια ἓξ τέταρτον γί κ ϛ δ ζ ὁ μεγαλοπρεπέστα παγαρχον ἰουλιαν ιος διʼ ἐμοῦ πνίννου βοηθ στοιχεῖ μοι τὸ ἐντάγιον ὡς πρόκ ἡ ἁγία τριάς ἀπολλῶς διοσκόρου δ φοιβάμμωνος τριαδέλφ εἰς λόγον δημόσιον κωμτ κ φθλᾶ γ κατολ κανόνος πρώτ ἰνδ κεράτια ἓξ τρίτον δωδέκατον γί κ ϛ γ ιβ ὁ ἐνδοξ γρχ ἰουλια λού οῦ πνίννου βοηθ ἐξκ τὸ ἐντάγιο πρόκ ἡ ἁγία τριά,Phthla,"απολλως, διοσκωρου, φοιβαμμωνος, τριαδελφου, ιουλιανος, πνιννου, φοιβαμμωνος, απολλως, τριαδελφου, διοσκορου, ιουλιανος, πνιννου, ","κωκμκης φθλα, κκωμης φκθκλκακ","['διοσκωρου: διοσκορου', 'παγαρχον: παγαρχος']"
TM 23846,nan,receipt,AD 550 - 551,gaplines γί χρ κερ ιϛ ιβ ζ ὁ ἐνδοξ πάγαρχος ἰουλιανὸς ἰλλούστρ διʼ ἐμοῦ πννου βοηθ στοιχεῖ μοι των κερ δεκαὲξ ἥμισυ ατον ζ ὡς πρόκ ἡ ἁγία τριάς διαγραφ κ α γ ιβ δέδωκεν ἀπολλῶς διοσκώρου δ φοιβαμμων καὶ μηνᾶ εἰς λόγον δημόσιον κωμτ κώμ φθλᾶ γ καταβολ τεσσαρησκαιδεκάτης ἰνδ χρυσοῦ κεράτια δεκαὲξ τρίτον δωδέκατον γί κ ιϛ γ ιβ λούστρ διʼ ἐμοῦ πνίννο βοηθ στοιχεῖ τον κερ δεκαὲξ τρίτον δωδέ τριάς,Phthla,"ιουλιανος, πνιννου, απολλως, διοσκωρου, φοιβαμμων, μηνα, ιουλιανος, πνιννου, ",κωκμκης φκθκλκακ,"['των: τα', 'διοσκωρου: διοσκορου', 'φοιβαμμων: φοιβαμμωνος', 'τεσσαρησκαιδεκατης: τεσσαρεσκαιδεκατης', 'τον: τα']"
TM 35842,nan,receipt,AD 500 - 550,καὶ εἰς τὴν καὶ παρούσης ἰνδικ καὶ εἰς σὴν ἀσφάλειαν ἀποχὴν ἐφʼ ὑπογραφῆς τοῦ ὲρ ἐῦ ὄντων καὶ ἀνισχύρων τῶν ἐνταγίων ἁ των σοι παρὰ τοῦ ἐμοῦ πατρὸς περιόντ ἰνδικ διʼ ἐμοῦ ἰωάννου ἰωσηφίου ἐξέδωκα τὴν πληρωτικὴν ἀποχή ἀξειωθείς ἔγραψα ὑπὲρ αὐτοῦ γράμμ μονάζ μοναστηρίου μετανοίας καὶ γραμ ἀκούσας παρὰ τοῦ highpunctus θιμένουhighpunctus ἐγράφη διʼ ἐμο,Aphrodito,"ιωαννου, ιωσηφιου, ",μοναστηριου μετανοιας,['αξειωθεις: αξιωθεις']
TM 35843,nan,contract,AD 500 - 599,αταφρονη ον πρὸς τὸ κανονισμὸν μετʼ ἀλλήλων τελεστῶν τοῦ μὴ περαιτέρου ου εἰ δὲ καταφρονήσομεν ν τῆς διώρυγος ἓξ καὶ εὐθὺς ὑμεῖς ἀπαιτηθῆναι ν παρʼ οἱουδήποτε συντελεστοῦ ς ἑνὸς μόνον ματίου σίτου σφαλλόμενον ἐξ ἡμῶν δώσει δίῳ κινδύνῳ καὶ πρὸς ἀσφάλειαν ὑμῶν καὶ βεβαίαν ἐφʼ ὑπογραφῆς ἡμῶν καὶ ἐπερ ὡμολ ἐθέμην ταύτην τὴν ὁμολογίαν ρήλιος ἴσακος ὁ προκ ἐθέμην ὐρήλιος μουσῆς ψαίου αν ὡς πρόκ αὐρήλιος ἀκούσας παρὰ τῶν θεμένων ῶ τῇ ὁμολογίᾳ ἀκούσας πα ράφ θεοῦ θέλ,Aphrodito,"αυρηλιος, αυρηλιος ισακος, αυρηλιος μουσης, ψαιου, αυρηλιος, αυρηλιος, ",,[]
TM 35920,nan,letter,AD 500 - 599,αὐτὸ εἰς τὸ ἔργον ἐρρῶσθαι ἐν κυρίῳ,Aphrodito,,,[]
